{
  "$schema": "https://raw.githubusercontent.com/osameh15/osameh.dev/main/portfolio.schema.json",
  "schemaVersion": "1.0.0",
  "project": {
    "slug": "osameh.dev",
    "name": "osameh.dev",
    "tagline": "An IDE-inspired, repository-driven software engineering portfolio with secure GitHub integration and automated deployment.",
    "summary": "A React/Vite portfolio that behaves like a developer workspace and repository-driven engineering platform: public GitHub projects self-describe through portfolio.json, project pages expose architecture and source exploration, engineering notes document real implementation decisions, live health diagnostics expose safe operational signals, and staged quality-gated CI/CD delivers the production experience.",
    "type": "Portfolio / developer platform",
    "lifecycle": "active",
    "featured": true,
    "featuredOrder": 0,
    "legacy": false
  },
  "ownership": {
    "role": "Full-Stack Developer & DevOps Engineer",
    "collaboration": "solo",
    "organization": null,
    "responsibilities": [
      "Product/UI design",
      "React/Vite frontend",
      "PHP API proxy",
      "GitHub integration",
      "Caching and security hardening",
      "PWA behavior",
      "SEO/social previews",
      "CI/CD deployment",
      "CDN integration"
    ]
  },
  "links": {
    "repository": "https://github.com/osameh15/osameh.dev",
    "live": "https://osameh.dev",
    "demo": null,
    "documentation": "./README.md",
    "package": null
  },
  "repository": {
    "owner": "osameh15",
    "defaultBranch": "main",
    "license": null,
    "name": "osameh.dev"
  },
  "stack": {
    "languages": [
      "TypeScript",
      "PHP",
      "JavaScript",
      "CSS",
      "HTML"
    ],
    "frameworks": [
      "React 19",
      "Vite 8",
      "Tailwind CSS 4"
    ],
    "libraries": [
      "DOMPurify",
      "marked",
      "lucide-react"
    ],
    "platforms": [
      "Web",
      "PWA",
      "Shared Linux hosting",
      "ParsPack CDN"
    ],
    "databases": [],
    "tooling": [
      "GitHub Actions",
      "lftp / FTPS",
      "npm",
      "TypeScript",
      "Service Worker",
      "Playwright",
      "Lighthouse CI"
    ],
    "concepts": [
      "Repository-driven portfolio",
      "CDN caching",
      "CSP",
      "Secure secret isolation",
      "FTPS certificate pinning",
      "PWA",
      "SEO",
      "OpenGraph",
      "Lazy loading",
      "Soft-404 compatibility",
      "Dynamic structured data",
      "Dynamic sitemap",
      "Staging environment",
      "CI quality gates",
      "Live health checks",
      "Engineering notes",
      "Published client case studies and capability areas",
      "Availability control",
      "English-only product interface",
      "Accessibility preferences",
      "Universal search"
    ]
  },
  "caseStudy": {
    "problem": "A traditional static portfolio would not demonstrate the depth of engineering work or stay synchronized with an evolving GitHub profile, while the selected shared-hosting environment could not run a persistent Node server.",
    "solution": "Use a static React/Vite frontend for fast CDN delivery, pair it with small PHP endpoints for authenticated GitHub access and server-side caching, then automate production delivery with GitHub Actions over a restricted FTPS account.",
    "highlights": [
      "IDE-style responsive UI with light/dark themes",
      "Dynamic public GitHub repository discovery",
      "Repository-owned portfolio.json metadata with schema validation",
      "Featured project shortlist and guided Recruiter Mode",
      "Per-project architecture viewer driven by repository metadata",
      "Same-origin GitHub source explorer with file-size and path safeguards",
      "Live GitHub project metrics with language percentages, releases, license and repository signals",
      "README sanitization and repository-wide image galleries",
      "Project case studies, comparison, context menu, command palette and terminal",
      "PWA/offline support, resume viewer and secure contact form",
      "Per-project social previews and CDN-safe 404 routing",
      "GitHub Actions CI/CD with certificate-pinned FTPS deployment",
      "Dynamic project/note structured data and runtime sitemap generation",
      "Staging deployment channel with noindex protection and CI quality gates",
      "Live privacy-safe health center plus Markdown engineering notes",
      "Responsive mobile project navigation, viewport-capped modals, and scroll-synchronized Engineering Notes",
      "Published freelance/client case studies with deep-link SEO metadata plus a separate experience-backed capability layer",
      "Central availability configuration integrated with header, Terminal and recruiter-facing flows",
      "English-only interface contract with fixed en/LTR document metadata and no locale-switching state",
      "Accessibility Control Center with reduced motion, contrast, text scale and enhanced focus preferences",
      "Ranked Command Palette search across projects, notes, case studies, skills, experience and settings"
    ],
    "challenges": [
      {
        "title": "Shared hosting without a Node runtime",
        "description": "The original application architecture used server/runtime assumptions unsuitable for the purchased shared host.",
        "resolution": "Convert the UI to a Vite static build and move only the necessary server-side GitHub/contact logic into small PHP endpoints."
      },
      {
        "title": "Safe GitHub API usage",
        "description": "A GitHub token must improve rate limits without ever reaching the browser or repository.",
        "resolution": "Keep the token outside the web root, proxy GitHub calls through PHP and cache repository/README/image responses server-side."
      },
      {
        "title": "CDN behavior and custom routing",
        "description": "CDN caching and upstream error replacement affected deployments and 404 rendering.",
        "resolution": "Use hashed immutable assets, no-cache HTML/build metadata, CDN-safe routing and a noindex soft-404 compatibility layer for the IDE 404 experience."
      },
      {
        "title": "Automated shared-host deployment",
        "description": "Manual uploads were slow and error-prone, while the FTPS certificate chain was not publicly trusted.",
        "resolution": "Deploy through GitHub Actions using a directory-scoped FTP account and explicit certificate fingerprint pinning before credentials are sent."
      }
    ],
    "results": [
      "Push-to-production CI/CD workflow",
      "Static/CDN-friendly production architecture with server-side secret isolation",
      "Portfolio pages stay synchronized with public GitHub repositories",
      "Each repository can own its case study, architecture, recruiter data and source-explorer policy",
      "Recruiters can inspect featured evidence, architecture and public source without leaving the portfolio",
      "Project detail pages combine authored metadata with cached live GitHub metrics and source evidence"
    ]
  },
  "architecture": {
    "summary": "The browser receives a static React/Vite application through ParsPack CDN. Same-origin PHP endpoints provide GitHub, contact and analytics capabilities, while server-side private storage keeps credentials and caches outside the public web root. GitHub Actions builds and deploys the dist directory over pinned FTPS.",
    "nodes": [
      {
        "id": "browser",
        "label": "Browser / PWA",
        "type": "client"
      },
      {
        "id": "cdn",
        "label": "ParsPack CDN",
        "type": "edge"
      },
      {
        "id": "static",
        "label": "React + Vite static app",
        "type": "frontend"
      },
      {
        "id": "php",
        "label": "PHP API endpoints",
        "type": "service"
      },
      {
        "id": "private",
        "label": "Private secrets + cache",
        "type": "storage"
      },
      {
        "id": "github",
        "label": "GitHub REST API",
        "type": "external"
      },
      {
        "id": "actions",
        "label": "GitHub Actions",
        "type": "ci"
      },
      {
        "id": "hosting",
        "label": "Shared hosting public_html",
        "type": "hosting"
      },
      {
        "id": "metadata",
        "label": "portfolio.json metadata",
        "type": "data"
      },
      {
        "id": "explorer",
        "label": "Source Explorer + Architecture Viewer",
        "type": "frontend"
      }
    ],
    "edges": [
      {
        "from": "browser",
        "to": "cdn",
        "label": "HTTPS"
      },
      {
        "from": "cdn",
        "to": "static",
        "label": "serves/caches"
      },
      {
        "from": "static",
        "to": "php",
        "label": "same-origin API"
      },
      {
        "from": "php",
        "to": "private",
        "label": "reads secrets/cache"
      },
      {
        "from": "php",
        "to": "github",
        "label": "authenticated REST"
      },
      {
        "from": "actions",
        "to": "hosting",
        "label": "FTPS deploy"
      },
      {
        "from": "hosting",
        "to": "cdn",
        "label": "origin"
      },
      {
        "from": "github",
        "to": "metadata",
        "label": "serves metadata/source"
      },
      {
        "from": "metadata",
        "to": "explorer",
        "label": "drives project views"
      },
      {
        "from": "explorer",
        "to": "static",
        "label": "renders in workspace"
      }
    ]
  },
  "media": {
    "cover": {
      "strategy": "first-gallery-image",
      "path": null,
      "alt": "osameh.dev Portfolio"
    },
    "gallery": {
      "autoDiscover": true,
      "include": [
        "images/**",
        "Images/**",
        "docs/**",
        "screenshots/**",
        "Screenshots/**",
        "media/**",
        "assets/**",
        "Assets/**"
      ],
      "exclude": [